{
  "schema_version": "1.0",
  "run_id": "20260725042538-b1b56f",
  "classification": "synthetic",
  "engine": "codex_mirofish_method",
  "generated_at": "2026-07-26T06:49:20.2887861+09:00",
  "environment": {
    "summary": "2026〜2031年の日本データセンター市場。AI需要は伸びるが、系統接続、建設能力、アンカー契約、地域受容性が案件の稼働時期を規定する。",
    "horizon": "2026〜2031年",
    "geography": [
      "東京圏",
      "大阪圏",
      "北海道",
      "九州"
    ],
    "initial_conditions": [
      "AI計算需要と国内常設化投資は継続している。",
      "電力需要は増加方向へ転じ、DCの接続に長期を要する事例がある。",
      "東京・大阪では供給計画も厚く、需要増加だけでは個別案件の採算を保証しない。",
      "高密度化とPUE目標が液冷・計測・運用改善を押し上げる。"
    ],
    "state_variables": [
      {
        "id": "grid_access",
        "label": "系統接続確度",
        "initial": "low-to-medium"
      },
      {
        "id": "ai_demand",
        "label": "AI需要持続性",
        "initial": "high-uncertainty growth"
      },
      {
        "id": "construction",
        "label": "施工・機器供給余力",
        "initial": "constrained"
      },
      {
        "id": "prelease",
        "label": "事前契約率",
        "initial": "uneven"
      },
      {
        "id": "acceptance",
        "label": "地域受容性",
        "initial": "project-specific"
      },
      {
        "id": "flexibility",
        "label": "計算負荷の可搬・柔軟性",
        "initial": "early"
      }
    ],
    "evidence_ids": [
      "e1-occto-2026-demand",
      "e3-meti-5gw-grid",
      "e4-enecho-efficiency",
      "e14-jll-japan",
      "e15-cbre-global"
    ]
  },
  "agents": [
    {
      "id": "a-grid-operator",
      "name": "系統運用・送配電主体",
      "archetype": "infrastructure gatekeeper",
      "objective": "供給信頼度を維持しながら、実現性の高い接続案件を順序づける。",
      "capabilities": [
        "接続検討",
        "系統増強計画",
        "工期提示"
      ],
      "constraints": [
        "増強リードタイム",
        "費用負担",
        "需給信頼度"
      ],
      "decision_rules": [
        "需要表明より接続実現性を優先",
        "段階増強と確度の高い案件を優先"
      ],
      "evidence_ids": [
        "e1-occto-2026-demand",
        "e3-meti-5gw-grid",
        "e12-ntt-tepco"
      ]
    },
    {
      "id": "a-hyperscale-buyer",
      "name": "AI・クラウド大口需要家",
      "archetype": "anchor capacity buyer",
      "objective": "期限内に高密度容量を確保し、東西冗長と拡張余地を持つ。",
      "capabilities": [
        "長期契約",
        "大型投資",
        "複数地域への配分"
      ],
      "constraints": [
        "稼働期限",
        "GPU世代交代",
        "需要予測誤差"
      ],
      "decision_rules": [
        "接続日と運転密度を価格より先に評価",
        "不確実なら段階契約する"
      ],
      "evidence_ids": [
        "e7-aws-investment",
        "e8-microsoft-investment",
        "e15-cbre-global"
      ]
    },
    {
      "id": "a-dc-developer",
      "name": "通信・DC開発運営主体",
      "archetype": "capital-intensive operator",
      "objective": "接続済み容量を確保し、事前契約を伴う稼働資産へ転換する。",
      "capabilities": [
        "用地取得",
        "設備投資",
        "顧客獲得",
        "ネットワーク運用"
      ],
      "constraints": [
        "建設費",
        "空室リスク",
        "資本コスト",
        "接続時期"
      ],
      "decision_rules": [
        "アンカー契約前の全面着工を避ける",
        "既存電力資産を新規用地より高く評価"
      ],
      "evidence_ids": [
        "e9-softbank-tomakomai",
        "e10-softbank-sakai",
        "e11-kddi-sakai",
        "e14-jll-japan"
      ]
    },
    {
      "id": "a-brownfield-owner",
      "name": "大電力工場・跡地所有者",
      "archetype": "scarce asset seller",
      "objective": "遊休資産の価値を最大化し、転用責任と費用を限定する。",
      "capabilities": [
        "既存受電設備",
        "広い用地",
        "産業インフラ"
      ],
      "constraints": [
        "汚染・撤去",
        "権利関係",
        "転用適合性"
      ],
      "decision_rules": [
        "接続価値が証明されれば競争入札",
        "不確実な改修費は買い手へ移転"
      ],
      "evidence_ids": [
        "e10-softbank-sakai",
        "e11-kddi-sakai",
        "e12-ntt-tepco"
      ]
    },
    {
      "id": "a-epc-cooling",
      "name": "EPC・液冷統合主体",
      "archetype": "execution bottleneck supplier",
      "objective": "高密度改修を標準化し、停止時間と性能責任を価格へ反映する。",
      "capabilities": [
        "電気設備",
        "冷却設計",
        "改修施工",
        "性能試験"
      ],
      "constraints": [
        "技術者不足",
        "既存設備差異",
        "停止可能時間"
      ],
      "decision_rules": [
        "機器販売より責任範囲の明確な統合案件を選ぶ",
        "実測データがない施設は段階診断する"
      ],
      "evidence_ids": [
        "e4-enecho-efficiency",
        "e16-vertiv-idcf",
        "e17-nttf-cooling"
      ]
    },
    {
      "id": "a-financier",
      "name": "インフラ資本・金融主体",
      "archetype": "risk allocator",
      "objective": "契約済みキャッシュフローを確保し、未接続・未契約リスクを抑える。",
      "capabilities": [
        "プロジェクト金融",
        "段階投資",
        "再編資本"
      ],
      "constraints": [
        "金利",
        "評価損",
        "建設遅延",
        "テナント集中"
      ],
      "decision_rules": [
        "接続日と事前契約を融資条件にする",
        "計画MWを稼働MWとして評価しない"
      ],
      "evidence_ids": [
        "e14-jll-japan",
        "e15-cbre-global"
      ]
    },
    {
      "id": "a-enterprise-buyer",
      "name": "国内企業・公共需要家",
      "archetype": "latency and sovereignty buyer",
      "objective": "国内運用、可用性、予算予見性を確保しながらAI利用を拡大する。",
      "capabilities": [
        "長期利用契約",
        "ワークロード分割"
      ],
      "constraints": [
        "移行コスト",
        "社内AI ROI",
        "データ所在地",
        "遅延"
      ],
      "decision_rules": [
        "需要が不確実なら従量・段階契約",
        "可搬できない処理は大都市圏へ残す"
      ],
      "evidence_ids": [
        "e7-aws-investment",
        "e8-microsoft-investment",
        "e22-meti-local-distribution"
      ]
    },
    {
      "id": "a-regional-coalition",
      "name": "地方自治体・地域連合",
      "archetype": "location and consent broker",
      "objective": "雇用・税収・インフラ便益を得つつ、電力・水・騒音負担を管理する。",
      "capabilities": [
        "用地調整",
        "許認可",
        "地域合意",
        "支援制度"
      ],
      "constraints": [
        "住民合意",
        "水資源",
        "電力の地域便益",
        "保守人材"
      ],
      "decision_rules": [
        "地域便益と開示が弱い案件を遅らせる",
        "段階開業と測定可能な約束を優先"
      ],
      "evidence_ids": [
        "e4-enecho-efficiency",
        "e9-softbank-tomakomai",
        "e22-meti-local-distribution"
      ]
    },
    {
      "id": "a-flex-orchestrator",
      "name": "計算負荷・電力柔軟運用主体",
      "archetype": "coordination challenger",
      "objective": "GPUジョブを料金・電力余力・SLAに応じて時間・地域移動させる。",
      "capabilities": [
        "ジョブスケジューリング",
        "EMS連携",
        "成果連動契約"
      ],
      "constraints": [
        "顧客SLA",
        "データ移動",
        "標準API不足",
        "実証不足"
      ],
      "decision_rules": [
        "中断可能負荷から開始",
        "節減効果を測定できない案件は受けない"
      ],
      "evidence_ids": [
        "e3-meti-5gw-grid",
        "e9-softbank-tomakomai"
      ]
    },
    {
      "id": "a-market-challenger",
      "name": "小規模・専門DC事業者",
      "archetype": "niche innovator",
      "objective": "大手が取りにくい高密度改修、地方拠点、運用最適化で差別化する。",
      "capabilities": [
        "迅速な実証",
        "小規模導入",
        "専門顧客対応"
      ],
      "constraints": [
        "資本規模",
        "調達力",
        "大口顧客信用"
      ],
      "decision_rules": [
        "全面新設より既存資産と共同実証",
        "大手との補完関係を優先"
      ],
      "evidence_ids": [
        "e16-vertiv-idcf",
        "e17-nttf-cooling",
        "e22-meti-local-distribution"
      ]
    }
  ],
  "rounds": 6,
  "round_log": [
    {
      "round": 1,
      "focus": "需要表明と投資意図",
      "summary": "需要家と開発主体は容量確保を急ぐが、金融主体は計画MWではなく接続日と事前契約を要求した。",
      "actions": [
        "大口需要家が東西二地域の段階契約を提示",
        "DC開発主体が複数候補地を確保",
        "金融主体が接続回答を融資前提に設定"
      ],
      "state_changes": [
        "需要期待は高止まり",
        "未接続用地の評価が二極化",
        "事前契約の交渉力が上昇"
      ],
      "minority_views": [
        "企業需要家はAI ROI未確立を理由に全面予約を拒否"
      ],
      "evidence_ids": [
        "e7-aws-investment",
        "e8-microsoft-investment",
        "e14-jll-japan",
        "e15-cbre-global"
      ]
    },
    {
      "round": 2,
      "focus": "系統接続キューと立地再評価",
      "summary": "系統主体の長期工期提示により、土地面積より既存受電設備と接続確度が価格形成の中心になった。",
      "actions": [
        "系統主体が段階接続を提案",
        "開発主体がブラウンフィールドへ移行",
        "地方連合が通信・人材条件を追加"
      ],
      "state_changes": [
        "接続済み資産プレミアムが上昇",
        "未接続グリーンフィールドの着工が後退",
        "地方分散は選別的に進行"
      ],
      "minority_views": [
        "小規模事業者は10〜20MW級の分散拠点を主張"
      ],
      "evidence_ids": [
        "e1-occto-2026-demand",
        "e3-meti-5gw-grid",
        "e10-softbank-sakai",
        "e11-kddi-sakai",
        "e12-ntt-tepco"
      ]
    },
    {
      "round": 3,
      "focus": "介入A：接続確度台帳と段階投資ゲート",
      "summary": "共通台帳は探索とDDを短縮したが、物理的な系統容量は増やさず、確度の低い案件を早期に落とす効果が中心だった。",
      "actions": [
        "系統・開発・金融主体が接続状態の共通定義を採用",
        "金融主体が接続・アンカー・建設単価のゲートを導入",
        "用地所有者が接続資料を開示"
      ],
      "state_changes": [
        "投機案件の資金調達確率が低下",
        "実行可能案件へ資本が集中",
        "DD期間が短縮"
      ],
      "minority_views": [
        "用地所有者は情報公開による交渉力低下を懸念"
      ],
      "evidence_ids": [
        "e3-meti-5gw-grid",
        "e12-ntt-tepco",
        "e14-jll-japan"
      ]
    },
    {
      "round": 4,
      "focus": "介入B：柔軟計算負荷と高密度改修",
      "summary": "中断可能なAI学習・バッチ処理では柔軟運用が接続制約を緩和したが、低遅延推論や主系ワークロードには適用できなかった。",
      "actions": [
        "柔軟運用主体が中断可能ジョブの成果連動実証を開始",
        "EPC主体が液冷改修を段階診断化",
        "需要家がSLA別に負荷を分割"
      ],
      "state_changes": [
        "一部地域で実効利用率が上昇",
        "液冷機器より統合改修能力が制約化",
        "運用データの価値が上昇"
      ],
      "minority_views": [
        "大口需要家はデータ移動と障害責任を理由に地域移動を限定"
      ],
      "evidence_ids": [
        "e3-meti-5gw-grid",
        "e4-enecho-efficiency",
        "e16-vertiv-idcf",
        "e17-nttf-cooling"
      ]
    },
    {
      "round": 5,
      "focus": "反実仮想：AI需要の一時鈍化",
      "summary": "需要が想定を下回ると、未契約新設は価格競争に陥る一方、低原価既存施設と段階投資案件は停止・転用オプションを保持した。",
      "actions": [
        "企業需要家が予約量を縮小",
        "金融主体が追加ドローダウンを停止",
        "開発主体が未着工フェーズを延期",
        "改修主体が省エネ成果契約へ転換"
      ],
      "state_changes": [
        "空室と価格圧力が上昇",
        "高レバレッジ案件の再編確率が上昇",
        "ブラウンフィールドと段階投資の相対価値が上昇"
      ],
      "minority_views": [
        "ハイパースケール需要家は長期的供給不足を見て好条件で容量を確保"
      ],
      "evidence_ids": [
        "e14-jll-japan",
        "e15-cbre-global"
      ]
    },
    {
      "round": 6,
      "focus": "収束：頑健な意思決定ルール",